# Article Title | URL
Johnson denies lying to the Queen about suspension | /news/uk-politics-49674516
Johnson denies lying to the Queen about suspension | /news/uk-politics-49674516
Supreme Court approves Trump's asylum curbs | /news/world-us-canada-49669811
Eurozone gets fresh aid to bolster flagging growth | /news/business-49674176
Video 2 minutes 49 secondsThe secret hospitals hiding from air strikes | /news/world-middle-east-49669939
Angry seal 'helps' bust alleged drug ring | /news/world-australia-49674673
Cult musician Daniel Johnston dies | /news/entertainment-arts-49673013
Trump plans ban on sale of flavoured e-cigarettes | /news/world-us-canada-49667688
Mugabe family rejects government funeral plans | /news/world-africa-49673513
Macron ally investigated over financial misconduct | /news/world-europe-49673313
Video 17 secondsIndependence hero embraces dying ex-president | /news/world-asia-49677553
JK Rowling donates £15.3m to MS research | /news/uk-scotland-49661840
Video 17 secondsIndependence hero embraces dying ex-president | /news/world-asia-49677553
JK Rowling donates £15.3m to MS research | /news/uk-scotland-49661840
France vows to block Facebook's Libra in Europe | /news/business-49677146
Spilled coffee forces plane to divert over Atlantic | /news/world-europe-49672351
'Vandal grannies' destroy noisy children's seesaw | /news/blogs-trending-49673953
VideoThe Africans risking death to reach the US | /news/world-latin-america-49667999
BBC World News TV | /news/world_radio_and_tv
AudioBBC World Service Radio | /sounds/play/live:bbc_world_service
Video‘All you can hear is your heartbeat’ | /news/world-asia-49529074
VideoFour years of Trudeau in two minutes | /news/world-us-canada-49661235
VideoThe black ballet pioneers | /news/stories-49648768
VideoUS airstrikes target island 'infested' with IS | /news/world-us-canada-49669610
House collapses in middle of night | /news/uk-england-coventry-warwickshire-49662520
VideoThe secret hospitals hiding from air strikes | /news/world-middle-east-49669939
VideoThe Africans risking death to reach the US | /news/world-latin-america-49667999
VideoFour years of Trudeau in two minutes | /news/world-us-canada-49661235
VideoAustralia bushfires are 'hotter, more intense' | /news/49659128
VideoUS airstrikes target island 'infested' with IS | /news/world-us-canada-49669610
VideoWhat to look for in the third Democratic debate | /news/world-us-canada-49670619
'I was raped, now I fear for my daughters' | /news/world-africa-49606146
Can a sacred drink boost an island's fortunes? | /news/business-49436907
At last... Joe Biden faces his biggest rival | /news/world-us-canada-49661236
How are the UK's talks with the EU going? | /news/uk-politics-49662531
Deadly job: No rush to join Mexico's new police | /news/world-latin-america-49551033
The strange persistence of the 'red mercury' myth | /news/blogs-trending-49641369
Was CIA ‘too white’ to spot 9/11 clues? | /news/world-us-canada-49582852
The first European Union? | https://www.bbc.co.uk/news/extra/A2MFANtn3Z/hanseatic_league
The billionaire hated by the hard right | https://www.bbc.co.uk/news/stories-49584157
The woman who became 2,500 people to survive | https://www.bbc.co.uk/news/world-australia-49589160
Greenland's ice faces melting 'death sentence' | https://www.bbc.co.uk/news/science-environment-49483580
PM denies lying to Queen over Parliament suspension | /news/uk-politics-49674516
California megachurch pastor kills himself | /news/world-us-canada-49667775
Roman skeletons found holding hands were both men | /news/world-europe-49672855
Parachutists in near-miss with 350mph fighter jets | /news/uk-england-cambridgeshire-49664560
Mugabe family rejects government funeral plans | /news/world-africa-49673513
Commons recall urged after no-deal papers released | /news/uk-politics-49671566
Cult musician Daniel Johnston dies | /news/entertainment-arts-49673013
'I was raped, now I fear for my daughters' | /news/world-africa-49606146
'Vandal grannies' destroy noisy children's seesaw | /news/blogs-trending-49673953
Supreme Court approves Trump's asylum curbs | /news/world-us-canada-49669811
What if the world lost all its trees? | https://www.bbc.com/future/story/20190911-what-would-happen-if-all-the-worlds-trees-disappeared
How burnout affected wartime bombmakers | https://www.bbc.com/worklife/article/20190912-what-wartime-munitionettes-can-teach-us-about-burnout
The woman who guards a glacier | https://www.bbc.com/travel/story/20190911-the-woman-watching-climate-change
The world’s most defiantly joyful song? | https://www.bbc.com/culture/story/20190911-pata-pata-the-worlds-most-defiantly-joyful-song
The puzzle of ancient brain surgery | https://www.bbc.com/earth/story/20160826-why-our-ancestors-drilled-holes-in-each-others-skulls
Why the 'friend-zone' exists | https://www.bbc.com/future/story/20190910-is-there-such-a-thing-as-the-friend-zone
The coffee shop that’s off the grid | https://www.bbc.com/worklife/article/20190905-living-without-electricity-in-the-heart-of-seoul
LiveRoot dropped three times as England pass 100 - clips, radio & text | /sport/live/cricket/47325235
Clijsters, 36, to make comeback in 2020 - eight years after retiring | /sport/tennis/49676558
'Is Wallin knocking me out? Definitely not' - Fury ready for Swede's challenge | /sport/boxing/49670433
England players to discuss racism response plan - Southgate | /sport/football/49672083
The teams, the history, the course: Europe bid to regain Solheim Cup from US | /sport/golf/49662421
VideoRoot escapes as Siddle spills a simple catch | /sport/av/cricket/49674692
VideoSmith's juggled catch dismisses Denly for 14 | /sport/av/cricket/49674689
